<!-- Definition scheme for snippets -->

<!-- Main-Element -->
<!ELEMENT tifo (info, version+)>
    <!ATTLIST tifo
        guid ID #REQUIRED
        isTemplate CDATA #IMPLIED
    >

<!-- General Meta-Information for the snippet -->
<!ELEMENT info (description, structure)>

<!ELEMENT description (#PCDATA)>

<!ELEMENT structure (level*)>
    <!ELEMENT level (#PCDATA)>
    <!ATTLIST level
            number CDATA #REQUIRED>

<!-- Definition of each version of the snippet -->
<!ELEMENT version (content+)>
<!ATTLIST version
 number CDATA #REQUIRED>

<!-- Content Definition for each version and a specific language--> 
<!ELEMENT content ANY>
<!ATTLIST content
    lang (none | de | en) #REQUIRED
    date CDATA #REQUIRED
    transtate (original | pending | translated) #REQUIRED
>

<!-- Allowable HTML-Elements -->
<!ELEMENT a ANY>
<!ATTLIST a
    id ID #IMPLIED
    class CDATA #IMPLIED
    href CDATA #REQUIRED
    target (_self | _blank | _parent | _top | _unfencedTop) #IMPLIED
>

<!ELEMENT address ANY>
<!ATTLIST address
    id ID #IMPLIED
    class CDATA #IMPLIED
>

<!ELEMENT p ANY>
<!ATTLIST p
    id ID #IMPLIED
    class CDATA #IMPLIED
>